"user_id","screen_name","Tipo_organismo","database","url_path","Tipo_organismo_2","Interbloque","diputado_bloque","description","profile_image_url","name","followers_count","image"
"174286642","MarceloKoenig","HCDN","HCDN_FDT_db"," ","HCDN","FRENTE DE TODOS","FRENTE DE TODOS","Diputado Nacional,
Secretario general en Descamisados
Profesor universitario
Padre de Manu y Rafa y Peronista hastas los huesos.","http://pbs.twimg.com/profile_images/422930760610635776/GCGiRbHd_normal.jpeg","Marcelo Koenig","5561","<img src="" http://pbs.twimg.com/profile_images/422930760610635776/GCGiRbHd_normal.jpeg "" height=""52""></img>"
"369120654","wadodecorrido","PEN","PEN_db"," ","PEN",NA,NA,"Mercedino. Militante. Peronista Kirchnerista. Ministro del Interior. Acá y en Instagram sí soy @wadodecorrido✌🏽","http://pbs.twimg.com/profile_images/1381722982045908994/X4lOKNuS_normal.jpg","Wado de Pedro 🇦🇷","311711","<img src="" http://pbs.twimg.com/profile_images/1381722982045908994/X4lOKNuS_normal.jpg "" height=""52""></img>"
"4769276561","arsaa2019","PROVINCIAL","PROV_db"," ","PROVINCIAL",NA,NA,"@Eduardoratier @alberto_rsaa @SanLuisGob1 #SanLuis","http://pbs.twimg.com/profile_images/1042464328253931520/71Aq4_d6_normal.jpg","Alberto Rodriguez Saa","4807","<img src="" http://pbs.twimg.com/profile_images/1042464328253931520/71Aq4_d6_normal.jpg "" height=""52""></img>"
"313081285","EduardoCostaSC","HSN","HCSN_db"," ","HSN",NA,NA,"Soy Eduardo Costa, Senador Nacional por Santa Cruz. Te invito a seguirme https://t.co/aW8y62aG1b","http://pbs.twimg.com/profile_images/887395024056590337/h1YdBDt5_normal.jpg","Eduardo Costa","17286","<img src="" http://pbs.twimg.com/profile_images/887395024056590337/h1YdBDt5_normal.jpg "" height=""52""></img>"
"40741753","omardemarchi","HCDN","HCDN_JXC_db"," ","TODXS","JUNTOS POR EL CAMBIO","PRO","Diputado Nacional Pro, Luján de Cuyo, Mendoza. 
Siempre mirando adelante.
Ser revolucionario en Argentina es intentar el equilibrio fiscal.
El populismo atrasa.","http://pbs.twimg.com/profile_images/1202017304218886145/J7FjRNdM_normal.jpg","Omar De Marchi","22160","<img src="" http://pbs.twimg.com/profile_images/1202017304218886145/J7FjRNdM_normal.jpg "" height=""52""></img>"
"928093098034462720","sapag_silvia","HSN","HCSN_db"," ","TODXS",NA,NA,"Feminista. Militante.","http://pbs.twimg.com/profile_images/1142992735382769664/dKau31tZ_normal.jpg","Silvia Sapag","1267","<img src="" http://pbs.twimg.com/profile_images/1142992735382769664/dKau31tZ_normal.jpg "" height=""52""></img>"
"171650522","CancilleriaARG","PEN","PEN_db"," ","PEN",NA,NA,"Bienvenidos al Ministerio de Relaciones Exteriores, Comercio Internacional y Culto de la República Argentina | 🇦🇷 Canciller @felipe_sola","http://pbs.twimg.com/profile_images/1387404561246265345/SyF50doH_normal.jpg","Cancillería Argentina 🇦🇷","260974","<img src="" http://pbs.twimg.com/profile_images/1387404561246265345/SyF50doH_normal.jpg "" height=""52""></img>"
"40858089","PinedoFederico","OTRXS","OTRXS_db"," ","OTRXS",NA,NA,"Presidí el Senado de la Nación, habiendo servido 16 años en el Congreso. Abogado especializado en Políticas Públicas y Regulación de Servicios Públicos.","http://pbs.twimg.com/profile_images/1204469039822704642/QuiF7GaB_normal.jpg","Federico Pinedo","244236","<img src="" http://pbs.twimg.com/profile_images/1204469039822704642/QuiF7GaB_normal.jpg "" height=""52""></img>"
"188159659","BlancaOsunaOK","HCDN","HCDN_FDT_db"," ","HCDN","FRENTE DE TODOS","FRENTE DE TODOS","Militante Peronista. Diputada Nacional por el Frente de Tod☀️s (2019-2023). Intendenta de la ciudad de Paraná (2011-2015).","http://pbs.twimg.com/profile_images/1280652687944626176/fAbYzNT3_normal.jpg","Blanca Osuna","7416","<img src="" http://pbs.twimg.com/profile_images/1280652687944626176/fAbYzNT3_normal.jpg "" height=""52""></img>"
"257460186","ManesF","OTRXS","OTRXS_db"," ","OTRXS",NA,NA,"Neurólogo y neurocientífico. Docente y escritor.
PhD in Sciences, Cambridge University.
Neurociencias Favaloro - Fundación INECO.
Investigador CONICET.","http://pbs.twimg.com/profile_images/1338834293951524868/-vH7qQgt_normal.jpg","Facundo Manes","294846","<img src="" http://pbs.twimg.com/profile_images/1338834293951524868/-vH7qQgt_normal.jpg "" height=""52""></img>"
"34455479","diegosantilli","PROVINCIAL","PROV_db"," ","PROVINCIAL",NA,NA,"Vicejefe del @GCBA, a cargo de @seguridadba. Contador Público (UBA). Fana de River. Construyendo con Analía, Teo, Nicky, Tonio, Lola y Male una gran familia.","http://pbs.twimg.com/profile_images/1371293566069260288/DZGaJMYk_normal.jpg","Diego Santilli","383702","<img src="" http://pbs.twimg.com/profile_images/1371293566069260288/DZGaJMYk_normal.jpg "" height=""52""></img>"
"1631369960","laurmachado","HSN","HCSN_db"," ","TODXS",NA,NA,"Abogada. Senadora Nacional (2015-2021). Vicepresidente segunda del PRO Nacional. Vicepresidente segunda del Senado de la Nación.","http://pbs.twimg.com/profile_images/878306999544532992/ayAyqxrO_normal.jpg","Laura Rodríguez Machado","22098","<img src="" http://pbs.twimg.com/profile_images/878306999544532992/ayAyqxrO_normal.jpg "" height=""52""></img>"
"527663666","ludeponti","PROVINCIAL","PROV_db"," ","TODXS",NA,NA,"Santafesina y sabalera 🙋🏻 Militante feminista del Evita y la CTEP ✌🏻Diputada Provincial - Diputada Nacional (Mandato Cumplido) 🏛","http://pbs.twimg.com/profile_images/1382700070257168385/6Ad5lOBx_normal.jpg","Lucila De Ponti","31767","<img src="" http://pbs.twimg.com/profile_images/1382700070257168385/6Ad5lOBx_normal.jpg "" height=""52""></img>"
"314982614","DiGiacomoLuis","HCDN","HCDN_UNIDFED_db"," ","HCDN","UNIDAD FEDERAL PARA EL DESARROLLO","JUNTOS SOMOS RIO NEGRO","Diputado Nacional - Juntos Somos Río Negro. Ex ministro de Gobierno de mi provincia. Psiquiatra. Interbloque Unidad Federal para el Desarrollo.","http://pbs.twimg.com/profile_images/1351665837988577282/kha68Dxp_normal.jpg","Luis Di Giacomo","1862","<img src="" http://pbs.twimg.com/profile_images/1351665837988577282/kha68Dxp_normal.jpg "" height=""52""></img>"
"301464513","Fte_Izquierda","OTRXS","OTRXS_db"," ","OTRXS",NA,NA,"#FITunidad 💚 Alianza entre @PTSarg, @PartidoObrero e @IzqSocialista.","http://pbs.twimg.com/profile_images/1138839913984663552/N4Tie69o_normal.jpg","Frente de Izquierda","80148","<img src="" http://pbs.twimg.com/profile_images/1138839913984663552/N4Tie69o_normal.jpg "" height=""52""></img>"
"143502765","JulioPiumato","OTRXS","OTRXS_db"," ","OTRXS",NA,NA,"SecGralUEJN(Judiciales)SecDDHH CGT,Dip Nac(MC)Pres Cees(Centro de Estudios estratégicos Suramericanos)Militante peronista,abogado, hincha de Boca.","http://pbs.twimg.com/profile_images/1183358948101017600/pws_3Jka_normal.jpg","Julio Piumato","37491","<img src="" http://pbs.twimg.com/profile_images/1183358948101017600/pws_3Jka_normal.jpg "" height=""52""></img>"
"1559163650","CarlaCarrizoAR","HCDN","HCDN_JXC_db"," ","HCDN","JUNTOS POR EL CAMBIO","UCR","Diputada nacional por la Ciudad de Buenos Aires. Vicepresidenta del bloque @diputadosucr #EvolucionRadical 🇵🇱 Politóloga y docente.","http://pbs.twimg.com/profile_images/1296461964122697728/WZC8cAWx_normal.jpg","Carla Carrizo","19703","<img src="" http://pbs.twimg.com/profile_images/1296461964122697728/WZC8cAWx_normal.jpg "" height=""52""></img>"
"61631756","omarperotti","PROVINCIAL","PROV_db"," ","PROVINCIAL",NA,NA,"Gobernador de Santa Fe.","http://pbs.twimg.com/profile_images/1242778720630439942/ZWoNNdxu_normal.jpg","Omar Perotti","50501","<img src="" http://pbs.twimg.com/profile_images/1242778720630439942/ZWoNNdxu_normal.jpg "" height=""52""></img>"
"4503140253","SenadorLuenzo","HSN","HCSN_db"," ","HSN",NA,NA,"Senador Nacional por Chubut. Presidente de la Comisión de Medios de Comunicación.  Vicepresidente de la Bicameral de la comunicación audiovisual.","http://pbs.twimg.com/profile_images/1171109555683700737/KZKBXNkx_normal.jpg","Alfredo Luenzo","10408","<img src="" http://pbs.twimg.com/profile_images/1171109555683700737/KZKBXNkx_normal.jpg "" height=""52""></img>"
"174010839","rgillavedra","OTRXS","OTRXS_db"," ","TODXS",NA,NA,"Abogado, hincha de Racing. Padre de 4 hijos y abuelo de Astor, Antígona y Fermín","http://pbs.twimg.com/profile_images/3659823510/00f902fb3a787345131eb6506bd41429_normal.jpeg","Ricardo Gil Lavedra","82599","<img src="" http://pbs.twimg.com/profile_images/3659823510/00f902fb3a787345131eb6506bd41429_normal.jpeg "" height=""52""></img>"
"1351611218","Alfreschiavoni","HCDN","HCDN_JXC_db"," ","HCDN","JUNTOS POR EL CAMBIO","PRO","Misionero. Padre de 2 hijos. Hincha de Boca. Diputado Nacional por Juntos por el Cambio.","http://pbs.twimg.com/profile_images/1146795148724117504/Fs6PXjNs_normal.png","Alfredo Schiavoni","5905","<img src="" http://pbs.twimg.com/profile_images/1146795148724117504/Fs6PXjNs_normal.png "" height=""52""></img>"
"90401187","CarolinaMoises","HCDN","HCDN_FDT_db"," ","HCDN","FRENTE DE TODOS","FRENTE DE TODOS","Representante de Jujuy, de nuestra gente. 
Mamá de Victoria. Diputada Nacional.","http://pbs.twimg.com/profile_images/1362435317911986178/O_6JOso__normal.jpg","Carolina Moises","13516","<img src="" http://pbs.twimg.com/profile_images/1362435317911986178/O_6JOso__normal.jpg "" height=""52""></img>"
"205380227","magdysierra","HCDN","HCDN_FDT_db"," ","HCDN","FRENTE DE TODOS","FRENTE DE TODOS","Militante Peronista, Arquitecta y de Racing✌. Jefa de Gabinete en @gestion_a.","http://pbs.twimg.com/profile_images/1297240737915064322/b7PShvkn_normal.jpg","Magdalena Sierra","9269","<img src="" http://pbs.twimg.com/profile_images/1297240737915064322/b7PShvkn_normal.jpg "" height=""52""></img>"
"79533471","Sofiabrambilla","HCDN","HCDN_JXC_db"," ","HCDN","JUNTOS POR EL CAMBIO","PRO","Mamá de Jose y Clemen. Diputada Nacional por Corrientes. Secretaria Nacional de @PRO_mujeres https://t.co/SbK4PJOulQ","http://pbs.twimg.com/profile_images/1351478140191842304/PVttCPZb_normal.jpg","Sofia Brambilla","7349","<img src="" http://pbs.twimg.com/profile_images/1351478140191842304/PVttCPZb_normal.jpg "" height=""52""></img>"
"627904763","produccion_arg","PEN","PEN_db"," ","PEN",NA,NA,"Cuenta oficial del Ministerio de Desarrollo Productivo de la República Argentina.","http://pbs.twimg.com/profile_images/1387408091055071236/tQbOQILM_normal.jpg","Ministerio de Desarrollo Productivo","250936","<img src="" http://pbs.twimg.com/profile_images/1387408091055071236/tQbOQILM_normal.jpg "" height=""52""></img>"
"159964842","maluisastorani","OTRXS","OTRXS_db"," ","TODXS",NA,NA,"Militante RADICAL y feminista, desde siempre y para siempre. Parlamentaria del Mercosur 💚","http://pbs.twimg.com/profile_images/1367872182169329666/YnZwALr0_normal.jpg","Maria Luisa Storani","14109","<img src="" http://pbs.twimg.com/profile_images/1367872182169329666/YnZwALr0_normal.jpg "" height=""52""></img>"
"247540617","trottanico","PEN","PEN_db"," ","TODXS",NA,NA,"Ministro de Educación de la República Argentina 🇦🇷","http://pbs.twimg.com/profile_images/1380596425592074244/1UgiKOyk_normal.jpg","Nicolás Trotta","139287","<img src="" http://pbs.twimg.com/profile_images/1380596425592074244/1UgiKOyk_normal.jpg "" height=""52""></img>"
"201825904","JnmLopez","HCDN","HCDN_JXC_db"," ","HCDN","JUNTOS POR EL CAMBIO","COALICION CIVICA","Diputado Nacional - Presidente del bloque Coalición Cívica - Abogado.","http://pbs.twimg.com/profile_images/1213486525155028998/nE-XsEfp_normal.jpg","Juan Manuel López","23059","<img src="" http://pbs.twimg.com/profile_images/1213486525155028998/nE-XsEfp_normal.jpg "" height=""52""></img>"
"162181568","slospennato","HCDN","HCDN_JXC_db"," ","HCDN","JUNTOS POR EL CAMBIO","PRO","Trabajadora incansable, orgullosa de ser parte del Equipo Pro. Diputada Nacional y Secretaria Parlamentaria del Interbloque CAMBIEMOS","http://pbs.twimg.com/profile_images/1031293810968547328/2xS_Q5no_normal.jpg","Silvia Lospennato","35408","<img src="" http://pbs.twimg.com/profile_images/1031293810968547328/2xS_Q5no_normal.jpg "" height=""52""></img>"
"301492316","fvallejoss","HCDN","HCDN_FDT_db"," ","HCDN","FRENTE DE TODOS","FRENTE DE TODOS","🇦🇷 Economista (UBA). Diputada Nacional por la Provincia de Buenos Aires #UnidadCiudadana","http://pbs.twimg.com/profile_images/1129176419509125120/ZJ_u8T8b_normal.jpg","Fernanda Vallejos","87094","<img src="" http://pbs.twimg.com/profile_images/1129176419509125120/ZJ_u8T8b_normal.jpg "" height=""52""></img>"
"259681081","AntonioBonfatti","OTRXS","OTRXS_db"," ","OTRXS",NA,NA,"Médico. Presidente del Partido Socialista de la República Argentina.","http://pbs.twimg.com/profile_images/1107759867069120512/8wXgkK9w_normal.png","Antonio Bonfatti","83469","<img src="" http://pbs.twimg.com/profile_images/1107759867069120512/8wXgkK9w_normal.png "" height=""52""></img>"
"141286250","GugaLusto","HSN","HCSN_db"," ","HSN",NA,NA,"Senador Nacional bloque #UCR coalición #JuntosPorElCambio. Casado con una gran mujer. Papá de Gaspar.","http://pbs.twimg.com/profile_images/1150544919670472704/2Dzh2ReR_normal.jpg","Martín Lousteau","1155025","<img src="" http://pbs.twimg.com/profile_images/1150544919670472704/2Dzh2ReR_normal.jpg "" height=""52""></img>"
"705158078","fsancheznqn","HCDN","HCDN_JXC_db"," ","HCDN","JUNTOS POR EL CAMBIO","PRO","Diputado Nacional por Neuquén. 
Profamilia. Batallando por La Argentina grande.
Casado con María Inés, padre de 5.","http://pbs.twimg.com/profile_images/1285781883037650953/7NfxL8yR_normal.jpg","Francisco Sánchez 🇦🇷","19530","<img src="" http://pbs.twimg.com/profile_images/1285781883037650953/7NfxL8yR_normal.jpg "" height=""52""></img>"
"257485371","RaulAOthacehe","OTRXS","OTRXS_db"," ","OTRXS",NA,NA,"Twitter Oficial del Dr. Raúl Alfredo Othacehé. Merlo, Buernos Aires - Argentina","http://pbs.twimg.com/profile_images/1154378514788945921/VtOHL5wR_normal.jpg","Raúl Othacehé","1697","<img src="" http://pbs.twimg.com/profile_images/1154378514788945921/VtOHL5wR_normal.jpg "" height=""52""></img>"
"607590053","gustavovaldesok","PROVINCIAL","PROV_db"," ","PROVINCIAL",NA,NA,"Gobernador de la provincia de Corrientes.","http://pbs.twimg.com/profile_images/1340114999533035523/b7PC4CwC_normal.jpg","Gustavo Valdés","42219","<img src="" http://pbs.twimg.com/profile_images/1340114999533035523/b7PC4CwC_normal.jpg "" height=""52""></img>"
"466887457","CaroGaillard","HCDN","HCDN_FDT_db"," ","HCDN","FRENTE DE TODOS","FRENTE DE TODOS","Abogada. Dip. Nac. por la Pcia. de ER en Frente de Todos. Presidenta de la Comisión de Legislacion Penal. HCDN. Mamá de Felipe 💚🌈🌱","http://pbs.twimg.com/profile_images/1326944416322514945/gTzPExXK_normal.jpg","Carolina Gaillard","14081","<img src="" http://pbs.twimg.com/profile_images/1326944416322514945/gTzPExXK_normal.jpg "" height=""52""></img>"
"2883216219","gabrielamlena","HCDN","HCDN_JXC_db"," ","HCDN","JUNTOS POR EL CAMBIO","UCR","Mamá de Santi. Diputada Nacional por @juntoscambioar (2019-2023) 🇵🇱 Orgullosamente entrerriana y chajariense ❤","http://pbs.twimg.com/profile_images/1337127505065635840/LG7J4iGF_normal.jpg","Gabriela Lena","3657","<img src="" http://pbs.twimg.com/profile_images/1337127505065635840/LG7J4iGF_normal.jpg "" height=""52""></img>"
"276092562","Claudiagmarquez","HCDN","HCDN_FEDERAL_db"," ","HCDN","FEDERAL","CORDOBA FEDERAL","Diputada Nacional por la Provincia de Córdoba- Abogada","http://pbs.twimg.com/profile_images/1367448772066873346/HM0lwqjH_normal.jpg","Claudia G. Marquez","700","<img src="" http://pbs.twimg.com/profile_images/1367448772066873346/HM0lwqjH_normal.jpg "" height=""52""></img>"
"306546830","NicoDujovne","OTRXS","OTRXS_db"," ","OTRXS",NA,NA,"","http://pbs.twimg.com/profile_images/816674762084798464/YJQMESUU_normal.jpg","Nicolas Dujovne","141494","<img src="" http://pbs.twimg.com/profile_images/816674762084798464/YJQMESUU_normal.jpg "" height=""52""></img>"
"200859218","GennusoG","PROVINCIAL","PROV_db"," ","PROVINCIAL",NA,NA,"Intendente de San Carlos de Bariloche @MunicBariloche. Trabajo para que vivamos mejor en nuestra ciudad. Ingeniero Nuclear. Emprendedor Social. Hincha de Boca","http://pbs.twimg.com/profile_images/1312051853392261125/wpmUv9u4_normal.jpg","Gustavo Gennuso","3629","<img src="" http://pbs.twimg.com/profile_images/1312051853392261125/wpmUv9u4_normal.jpg "" height=""52""></img>"
"1223265849219407873","AlumeKarim","HCDN","HCDN_FDT_db"," ","HCDN","FRENTE DE TODOS","FRENTE DE TODOS","Casado, tres hijos. Abogado. Desarrollista Diputado Nacional Bloque de Todos. Hincha de unión. Productor Agropecuario. #YoAmoSanLuis","http://pbs.twimg.com/profile_images/1223267164574167040/bZyLTztl_normal.jpg","Karim Alume","522","<img src="" http://pbs.twimg.com/profile_images/1223267164574167040/bZyLTztl_normal.jpg "" height=""52""></img>"
"38078904","gabicerru","HCDN","HCDN_FDT_db"," ","HCDN","FRENTE DE TODOS","FRENTE DE TODOS","Periodista, escritora, docente, madre, ecologista y feminista. Diputada nacional Frente de Todes.","http://pbs.twimg.com/profile_images/1045792929372131328/v6mnFT1m_normal.jpg","Gabriela Cerruti","266662","<img src="" http://pbs.twimg.com/profile_images/1045792929372131328/v6mnFT1m_normal.jpg "" height=""52""></img>"
"234441059","mariomeoni","PEN","PEN_db"," ","PEN",NA,NA,"Ministro de Transporte de la Nación 🇦🇷

Esposo de Laura y papá de Felipe y Robertino

Hincha de Sarmiento de Junín","http://pbs.twimg.com/profile_images/1380662258179641349/EFc3v6Xc_normal.jpg","Mario Meoni","33914","<img src="" http://pbs.twimg.com/profile_images/1380662258179641349/EFc3v6Xc_normal.jpg "" height=""52""></img>"
"234032767","CaroStanley","OTRXS","OTRXS_db"," ","OTRXS",NA,NA,"Mamá de Mateo y Juan. Ministra de Desarrollo Social de la Ciudad (2011 - 2015) y Ministra de Salud y Desarrollo Social de la Nación (2015 - 2019). Abogada.","http://pbs.twimg.com/profile_images/970370553445015555/CXaxMNZd_normal.jpg","Carolina Stanley","254412","<img src="" http://pbs.twimg.com/profile_images/970370553445015555/CXaxMNZd_normal.jpg "" height=""52""></img>"
"288342621","FelipeMiguelBA","PROVINCIAL","PROV_db"," ","PROVINCIAL",NA,NA,"Jefe de Gabinete de la mejor ciudad del mundo. PRO. CABA. Dato, no relato.","http://pbs.twimg.com/profile_images/1268887605065678850/tRUBZBEZ_normal.jpg","Felipe Miguel","28575","<img src="" http://pbs.twimg.com/profile_images/1268887605065678850/tRUBZBEZ_normal.jpg "" height=""52""></img>"
"1215668032934117378","JCuattromo","PROVINCIAL","PROV_db"," ","PROVINCIAL",NA,NA,"Presidente del Banco de la Provincia de Buenos Aires. Presidente del Grupo Provincia. Economista (UBA).","http://pbs.twimg.com/profile_images/1220713777580118016/vNlsVrTk_normal.jpg","Juan Cuattromo","6287","<img src="" http://pbs.twimg.com/profile_images/1220713777580118016/vNlsVrTk_normal.jpg "" height=""52""></img>"
"704175163","LucilaLehmann","HCDN","HCDN_JXC_db"," ","HCDN","JUNTOS POR EL CAMBIO","COALICION CIVICA","Diputada Nacional por Juntos por el Cambio.
Santafesina. Humanista. Presidente de la @CCivicaSantaFe.","http://pbs.twimg.com/profile_images/1372375055410327552/W_PhxQvS_normal.jpg","Lucila Lehmann","40342","<img src="" http://pbs.twimg.com/profile_images/1372375055410327552/W_PhxQvS_normal.jpg "" height=""52""></img>"
"247540617","trottanico","PEN","PEN_db"," ","PEN",NA,NA,"Ministro de Educación de la República Argentina 🇦🇷","http://pbs.twimg.com/profile_images/1380596425592074244/1UgiKOyk_normal.jpg","Nicolás Trotta","139287","<img src="" http://pbs.twimg.com/profile_images/1380596425592074244/1UgiKOyk_normal.jpg "" height=""52""></img>"
"369120654","wadodecorrido","PEN","PEN_db"," ","TODXS",NA,NA,"Mercedino. Militante. Peronista Kirchnerista. Ministro del Interior. Acá y en Instagram sí soy @wadodecorrido✌🏽","http://pbs.twimg.com/profile_images/1381722982045908994/X4lOKNuS_normal.jpg","Wado de Pedro 🇦🇷","311711","<img src="" http://pbs.twimg.com/profile_images/1381722982045908994/X4lOKNuS_normal.jpg "" height=""52""></img>"
"307976282","jromero581","HCDN","HCDN_FDT_db"," ","TODXS","FRENTE DE TODOS","FRENTE DE TODOS","Contador Público. Diputado Nacional bloque @Diputados_Todos. Correntino y Peronista. Casado con Lilian. Papá de Ailín, Jazmín y Lautaro.","http://pbs.twimg.com/profile_images/1304568649211092993/9Ubyu5z9_normal.jpg","Jorge Antonio Romero","1043","<img src="" http://pbs.twimg.com/profile_images/1304568649211092993/9Ubyu5z9_normal.jpg "" height=""52""></img>"
"766293360","MBerhongaray","HCDN","HCDN_JXC_db"," ","HCDN","JUNTOS POR EL CAMBIO","UCR","Político y abogado. Diputado Nacional por La Pampa.","http://pbs.twimg.com/profile_images/1264035214923378690/HNePYftF_normal.jpg","Martín Berhongaray","716","<img src="" http://pbs.twimg.com/profile_images/1264035214923378690/HNePYftF_normal.jpg "" height=""52""></img>"
"879706780649082880","RicardoWellbach","HCDN","HCDN_UNIDFED_db"," ","HCDN","UNIDAD FEDERAL PARA EL DESARROLLO","FRENTE DE LA CONCORDIA MISIONERO","Diputado Nacional por la Provincia de MISIONES-  Partido Renovador Frente de la Concordia","http://pbs.twimg.com/profile_images/1350553998240186372/lMk7VfE1_normal.jpg","Ricardo Wellbach","5676","<img src="" http://pbs.twimg.com/profile_images/1350553998240186372/lMk7VfE1_normal.jpg "" height=""52""></img>"
"166022063","SanzErnesto","OTRXS","OTRXS_db"," ","OTRXS",NA,NA,"Abogado sanrafaelino, radical y militante del cambio en Argentina. Fundador de Cambiemos.","http://pbs.twimg.com/profile_images/634741913602670592/hsn6Wpbw_normal.jpg","Ernesto Sanz","285199","<img src="" http://pbs.twimg.com/profile_images/634741913602670592/hsn6Wpbw_normal.jpg "" height=""52""></img>"
"586933252","sergiounac","PROVINCIAL","PROV_db"," ","PROVINCIAL",NA,NA,"Gobernador de San Juan. ¡Entre todos construimos la provincia que soñamos! https://t.co/Idps423di2","http://pbs.twimg.com/profile_images/1060593443385344001/wQqJErgg_normal.jpg","Sergio Uñac","34611","<img src="" http://pbs.twimg.com/profile_images/1060593443385344001/wQqJErgg_normal.jpg "" height=""52""></img>"
"816001694","SchiavoniH","HSN","HCSN_db"," ","HSN",NA,NA,"Papá de dos hijos increíbles. Senador nacional por Misiones y Jefe de Bloque por el @proargentina","http://pbs.twimg.com/profile_images/1159200401184448512/Iu5ovmYz_normal.jpg","Humberto Schiavoni","7555","<img src="" http://pbs.twimg.com/profile_images/1159200401184448512/Iu5ovmYz_normal.jpg "" height=""52""></img>"
"937301562","MonicaFradeok","HCDN","HCDN_JXC_db"," ","HCDN","JUNTOS POR EL CAMBIO","COALICION CIVICA","Abogada. Diputada Nacional por la Pcia. Bs As. Coalición Cívica, en Juntos por el Cambio. Quilmeña. Por un Poder Judicial independiente.
mfrade@hcdn.gob.ar","http://pbs.twimg.com/profile_images/1342459157526544384/W_wD5Ixe_normal.jpg","Monica Frade","23077","<img src="" http://pbs.twimg.com/profile_images/1342459157526544384/W_wD5Ixe_normal.jpg "" height=""52""></img>"
"519497576","larroqueandres","HCDN","HCDN_FDT_db"," ","TODXS","FRENTE DE TODOS","FRENTE DE TODOS","Militante del Movimiento Nacional Justicialista. Secretario General de La Cámpora. Ministro de @MinDesarrolloBA.","http://pbs.twimg.com/profile_images/729818743526834176/eDvSeQoK_normal.jpg","Andrés Larroque","114823","<img src="" http://pbs.twimg.com/profile_images/729818743526834176/eDvSeQoK_normal.jpg "" height=""52""></img>"
"1574367007","AndresZottos","HCDN","HCDN_FEDERAL_db"," ","HCDN","FEDERAL","JUSTICIALISTA","Diputado Nacional por Salta","http://pbs.twimg.com/profile_images/1015425656807620609/-ieth2FA_normal.jpg","Andrés Zottos","2952","<img src="" http://pbs.twimg.com/profile_images/1015425656807620609/-ieth2FA_normal.jpg "" height=""52""></img>"
"154184640","Maxiferraro","HCDN","HCDN_JXC_db"," ","HCDN","JUNTOS POR EL CAMBIO","COALICION CIVICA","Presidente Coalición Cívica ARI. Diputado Nacional por la Ciudad de Buenos Aires. Coordinador de @junglacultural 🌎🚲♻️ 🌳🏳️‍🌈 🇦🇷","http://pbs.twimg.com/profile_images/1277744675840032770/XlHZXOqL_normal.jpg","maxi ferraro","37827","<img src="" http://pbs.twimg.com/profile_images/1277744675840032770/XlHZXOqL_normal.jpg "" height=""52""></img>"
"716750606334103552","igon_santiago","HCDN","HCDN_FDT_db"," ","HCDN","FRENTE DE TODOS","FRENTE DE TODOS","Diputado Nacional por Chubut, Frente De Todos. Cuenta oficial.","http://pbs.twimg.com/profile_images/1379006382901506049/4WD8-NBc_normal.jpg","Igon Santiago","8657","<img src="" http://pbs.twimg.com/profile_images/1379006382901506049/4WD8-NBc_normal.jpg "" height=""52""></img>"
"869269434124447744","JorgeFaurie","OTRXS","OTRXS_db"," ","OTRXS",NA,NA,"Diplomático argentino. Canciller (2017-2019).","http://pbs.twimg.com/profile_images/1104081733534793729/eYCGGVfe_normal.jpg","Jorge Faurie","35109","<img src="" http://pbs.twimg.com/profile_images/1104081733534793729/eYCGGVfe_normal.jpg "" height=""52""></img>"
"53108902","MinTrabajoAR","PEN","PEN_db"," ","PEN",NA,NA,"Ministerio de Trabajo, Empleo y Seguridad Social de la Nación","http://pbs.twimg.com/profile_images/1387396863846985728/s6wJhNNq_normal.jpg","Ministerio de Trabajo, Empleo y Seguridad Social","334356","<img src="" http://pbs.twimg.com/profile_images/1387396863846985728/s6wJhNNq_normal.jpg "" height=""52""></img>"
"242461059","Lipovetzky","PROVINCIAL","PROV_db"," ","PROVINCIAL",NA,NA,"Diputado Provincia de Buenos Aires por Juntos por el Cambio! Diputado Nacional M.C. 2015-2019. De La Plata. Fana del más grande BOCA JUNIORS.Papá de tres soles.","http://pbs.twimg.com/profile_images/1293247104220004352/OK8rIm57_normal.jpg","Daniel Lipovetzky","42910","<img src="" http://pbs.twimg.com/profile_images/1293247104220004352/OK8rIm57_normal.jpg "" height=""52""></img>"
