"user_id","screen_name","Tipo_organismo","database","url_path","Tipo_organismo_2","Interbloque","diputado_bloque","description","profile_image_url","name","followers_count","image"
"127201323","MaydaCresto","HCDN","HCDN_FDT_db"," ","TODXS","FRENTE DE TODOS","FRENTE DE TODOS","Justicialista. 🇦🇷 Abogada-Escribana -Triatleta 🏊‍♀️🚴‍♀️🏃‍♀️ -Diputada Nacional por Entre Ríos - Frente de Tod ☀️s 🇦🇷","http://pbs.twimg.com/profile_images/1375250780354195460/550w0ruZ_normal.jpg","Mayda Cresto","7352","<img src="" http://pbs.twimg.com/profile_images/1375250780354195460/550w0ruZ_normal.jpg "" height=""52""></img>"
"2387764495","PaulaPenacca","HCDN","HCDN_FDT_db"," ","TODXS","FRENTE DE TODOS","FRENTE DE TODOS","Diputada Nacional por la Ciudad de Buenos Aires. Militante de La Cámpora.
Frente de tod☀️s.","http://pbs.twimg.com/profile_images/1270840617199906822/JD8VJrjO_normal.jpg","Paula Penacca","24057","<img src="" http://pbs.twimg.com/profile_images/1270840617199906822/JD8VJrjO_normal.jpg "" height=""52""></img>"
"4503140253","SenadorLuenzo","HSN","HCSN_db"," ","TODXS",NA,NA,"Senador Nacional por Chubut. Presidente de la Comisión de Medios de Comunicación.  Vicepresidente de la Bicameral de la comunicación audiovisual.","http://pbs.twimg.com/profile_images/1171109555683700737/KZKBXNkx_normal.jpg","Alfredo Luenzo","10408","<img src="" http://pbs.twimg.com/profile_images/1171109555683700737/KZKBXNkx_normal.jpg "" height=""52""></img>"
"326886601","Juancmarino","HSN","HCSN_db"," ","TODXS",NA,NA,"Pampeano. Actualmente, Senador Nacional UCR - CAMBIEMOS","http://pbs.twimg.com/profile_images/840211707574267904/9EqkVJ-x_normal.jpg","Juan Carlos Marino","6201","<img src="" http://pbs.twimg.com/profile_images/840211707574267904/9EqkVJ-x_normal.jpg "" height=""52""></img>"
"700402159687503877","Economia_Ar","PEN","PEN_db"," ","TODXS",NA,NA,"Cuenta oficial del Ministerio de Economía de la República Argentina.","http://pbs.twimg.com/profile_images/1387531697407811584/E4v911pS_normal.jpg","Ministerio de Economía de la Nación","63977","<img src="" http://pbs.twimg.com/profile_images/1387531697407811584/E4v911pS_normal.jpg "" height=""52""></img>"
"163551613","FtePatriaGrande","OTRXS","OTRXS_db"," ","TODXS",NA,NA,"Un conjunto de militantes de recorridos distintos, decidimos fundar este espacio para aportar a derrotar al neoliberalismo. Integramos el @frentedetodos","http://pbs.twimg.com/profile_images/1110551813181370375/e-6708HE_normal.jpg","Frente Patria Grande","26524","<img src="" http://pbs.twimg.com/profile_images/1110551813181370375/e-6708HE_normal.jpg "" height=""52""></img>"
"2456562907","ManziRubenOk","HCDN","HCDN_JXC_db"," ","TODXS","JUNTOS POR EL CAMBIO","COALICION CIVICA","Neurocirujano. Actual Diputado Nacional. #cambiemos #catamarca #ccari","http://pbs.twimg.com/profile_images/1121872198170443776/lG4HSqxK_normal.jpg","Rubén Horacio Manzi","2003","<img src="" http://pbs.twimg.com/profile_images/1121872198170443776/lG4HSqxK_normal.jpg "" height=""52""></img>"
"54414081","PatoBullrich","OTRXS","OTRXS_db"," ","TODXS",NA,NA,"Presidenta de @proargentina Dra. en Ciencias Políticas. Autora del libro “Guerra sin cuartel” 👇🏽","http://pbs.twimg.com/profile_images/1105528888149635078/cUcEpJuW_normal.png","Patricia Bullrich","1221220","<img src="" http://pbs.twimg.com/profile_images/1105528888149635078/cUcEpJuW_normal.png "" height=""52""></img>"
"31133330","danielscioli","PEN","HCDN_FDT_db"," ","TODXS","FRENTE DE TODOS","FRENTE DE TODOS","Embajador de Argentina en Brasil. 🇦🇷🇧🇷 Ex Diputado Nacional, Gobernador de la Provincia de Buenos Aires y Vicepresidente de la Nación.","http://pbs.twimg.com/profile_images/1115595379410497537/nWzBDSXP_normal.jpg","Daniel Scioli 🇦🇷","1398986","<img src="" http://pbs.twimg.com/profile_images/1115595379410497537/nWzBDSXP_normal.jpg "" height=""52""></img>"
"351974249","fedefrigerio","HCDN","HCDN_JXC_db"," ","TODXS","JUNTOS POR EL CAMBIO","PRO","Diputado Nacional por Tierra del Fuego AIAS @juntoscambioar. Fundador de Destino Sustentable ♻️. Consejero de la UIF en la UIA 🏭 Hincha de Boca 🇸🇪","http://pbs.twimg.com/profile_images/1200471772388380675/XsFqo6wn_normal.jpg","Federico Frigerio","1479","<img src="" http://pbs.twimg.com/profile_images/1200471772388380675/XsFqo6wn_normal.jpg "" height=""52""></img>"
"222124298","PabloCarroOk","HCDN","HCDN_FDT_db"," ","TODXS","FRENTE DE TODOS","FRENTE DE TODOS","Diputado Nacional 🇦🇷 por la provincia de #Córdoba. Secretario General de la @CTA_Cordoba.","http://pbs.twimg.com/profile_images/1143939244731392000/qW668uEH_normal.jpg","Pablo Carro","8362","<img src="" http://pbs.twimg.com/profile_images/1143939244731392000/qW668uEH_normal.jpg "" height=""52""></img>"
"35733038","Stolbizer","OTRXS","OTRXS_db"," ","TODXS",NA,NA,"#PartidoGEN de Argentina https://t.co/pRqFwL9A11 Presidenta","http://pbs.twimg.com/profile_images/1218227698906157057/ltl0eOkU_normal.jpg","Margarita Stolbizer","561235","<img src="" http://pbs.twimg.com/profile_images/1218227698906157057/ltl0eOkU_normal.jpg "" height=""52""></img>"
"368746304","gkatopodis","PEN","PEN_db"," ","TODXS",NA,NA,"Ministro de Obras Públicas de la Nación. Abogado, casado con Nancy, papá de Aylén y Santiago. #SanMartín es mi lugar.","http://pbs.twimg.com/profile_images/1380580618782793730/-hMeIWtp_normal.jpg","Gabriel Katopodis","79425","<img src="" http://pbs.twimg.com/profile_images/1380580618782793730/-hMeIWtp_normal.jpg "" height=""52""></img>"
"297543171","claramuzzio","PROVINCIAL","PROV_db"," ","TODXS",NA,NA,"Ministra de Espacio Público e Higiene Urbana de @gcba. Trabajo por un espacio público de calidad y sustentable para tener una @baciudadverde.","http://pbs.twimg.com/profile_images/1382315974590935046/7PUKu_5X_normal.jpg","Clara Muzzio","9661","<img src="" http://pbs.twimg.com/profile_images/1382315974590935046/7PUKu_5X_normal.jpg "" height=""52""></img>"
"188998649","cristiangirard","PROVINCIAL","PROV_db"," ","TODXS",NA,NA,"Director Ejecutivo de ARBA

IG: https://t.co/1WnY2VVvHQ","http://pbs.twimg.com/profile_images/1379631229214023688/wbtsXsCD_normal.jpg","Cristian Girard","6628","<img src="" http://pbs.twimg.com/profile_images/1379631229214023688/wbtsXsCD_normal.jpg "" height=""52""></img>"
"4493784808","MindefArg","PEN","PEN_db"," ","TODXS",NA,NA,"Cuenta oficial del Ministerio de Defensa de la República Argentina.

FB/MindefArg
IG/Mindefarg","http://pbs.twimg.com/profile_images/1387408935150313476/ETWrxZb5_normal.png","Ministerio Defensa","210969","<img src="" http://pbs.twimg.com/profile_images/1387408935150313476/ETWrxZb5_normal.png "" height=""52""></img>"
"2589783002","OmarGutierrezOk","PROVINCIAL","PROV_db"," ","TODXS",NA,NA,"Neuquino. Gobernador de mi querida provincia del Neuquén. Contador Público. Apasionado por la gestión.","http://pbs.twimg.com/profile_images/1342975784525438976/72Ri_xon_normal.jpg","Omar Gutierrez","52110","<img src="" http://pbs.twimg.com/profile_images/1342975784525438976/72Ri_xon_normal.jpg "" height=""52""></img>"
"179960598","CarlosTomada","PEN","PEN_db"," ","TODXS",NA,NA,"Embajador argentino en México 🇦🇷🇲🇽","http://pbs.twimg.com/profile_images/789101799399690240/Xv0XA3XI_normal.jpg","Carlos Tomada","166646","<img src="" http://pbs.twimg.com/profile_images/789101799399690240/Xv0XA3XI_normal.jpg "" height=""52""></img>"
"1347042146","RGBasualdo","HSN","HCSN_db"," ","TODXS",NA,NA,"Senador Nacional por San Juan.","http://pbs.twimg.com/profile_images/922258084935987200/mAqNyrFg_normal.jpg","Roberto Basualdo","4306","<img src="" http://pbs.twimg.com/profile_images/922258084935987200/mAqNyrFg_normal.jpg "" height=""52""></img>"
"34455479","diegosantilli","PROVINCIAL","PROV_db"," ","TODXS",NA,NA,"Vicejefe del @GCBA, a cargo de @seguridadba. Contador Público (UBA). Fana de River. Construyendo con Analía, Teo, Nicky, Tonio, Lola y Male una gran familia.","http://pbs.twimg.com/profile_images/1371293566069260288/DZGaJMYk_normal.jpg","Diego Santilli","383702","<img src="" http://pbs.twimg.com/profile_images/1371293566069260288/DZGaJMYk_normal.jpg "" height=""52""></img>"
"1723102656","LaspinaL","HCDN","HCDN_JXC_db"," ","TODXS","JUNTOS POR EL CAMBIO","PRO","Economista. Enamorado de mi familia. Hincha de Newell's. Diputado Nacional.","http://pbs.twimg.com/profile_images/971771058809393152/7lSKa0Xq_normal.jpg","Luciano Laspina","33998","<img src="" http://pbs.twimg.com/profile_images/971771058809393152/7lSKa0Xq_normal.jpg "" height=""52""></img>"
"148536486","gmmarangoni","OTRXS","OTRXS_db"," ","TODXS",NA,NA,"Politólogo. Profesor universitario. Director @MyR_economia. Escribí #PolíticaATP https://t.co/5NuSfoV8Si","http://pbs.twimg.com/profile_images/1147107684312899584/eiPTn1Cw_normal.jpg","Gustavo Marangoni","31071","<img src="" http://pbs.twimg.com/profile_images/1147107684312899584/eiPTn1Cw_normal.jpg "" height=""52""></img>"
"154184640","Maxiferraro","HCDN","HCDN_JXC_db"," ","TODXS","JUNTOS POR EL CAMBIO","COALICION CIVICA","Presidente Coalición Cívica ARI. Diputado Nacional por la Ciudad de Buenos Aires. Coordinador de @junglacultural 🌎🚲♻️ 🌳🏳️‍🌈 🇦🇷","http://pbs.twimg.com/profile_images/1277744675840032770/XlHZXOqL_normal.jpg","maxi ferraro","37827","<img src="" http://pbs.twimg.com/profile_images/1277744675840032770/XlHZXOqL_normal.jpg "" height=""52""></img>"
"937301562","MonicaFradeok","HCDN","HCDN_JXC_db"," ","TODXS","JUNTOS POR EL CAMBIO","COALICION CIVICA","Abogada. Diputada Nacional por la Pcia. Bs As. Coalición Cívica, en Juntos por el Cambio. Quilmeña. Por un Poder Judicial independiente.
mfrade@hcdn.gob.ar","http://pbs.twimg.com/profile_images/1342459157526544384/W_wD5Ixe_normal.jpg","Monica Frade","23077","<img src="" http://pbs.twimg.com/profile_images/1342459157526544384/W_wD5Ixe_normal.jpg "" height=""52""></img>"
"816001694","SchiavoniH","HSN","HCSN_db"," ","TODXS",NA,NA,"Papá de dos hijos increíbles. Senador nacional por Misiones y Jefe de Bloque por el @proargentina","http://pbs.twimg.com/profile_images/1159200401184448512/Iu5ovmYz_normal.jpg","Humberto Schiavoni","7555","<img src="" http://pbs.twimg.com/profile_images/1159200401184448512/Iu5ovmYz_normal.jpg "" height=""52""></img>"
"374115730","NicolasdelCano","HCDN","OTRXS_db"," ","TODXS","PTS - FRENTE DE IZQUIERDA","PTS - FRENTE DE IZQUIERDA","Diputado Nacional. @PTSarg - @Fte_Izquierda.","http://pbs.twimg.com/profile_images/968444442666561536/SyqIM-T0_normal.jpg","Nicolas del Caño","137722","<img src="" http://pbs.twimg.com/profile_images/968444442666561536/SyqIM-T0_normal.jpg "" height=""52""></img>"
"3125573339","OsmarMonaldi","HCDN","HCDN_JXC_db"," ","TODXS","JUNTOS POR EL CAMBIO","PRO","Jujeño. Diputado Nacional por Jujuy","http://pbs.twimg.com/profile_images/883751276873469953/NbM1IqtM_normal.jpg","Osmar Monaldi","1616","<img src="" http://pbs.twimg.com/profile_images/883751276873469953/NbM1IqtM_normal.jpg "" height=""52""></img>"
"3342878295","arcionimariano","PROVINCIAL","PROV_db"," ","TODXS",NA,NA,"Escribano Público. Gobernador de la provincia del Chubut.","http://pbs.twimg.com/profile_images/927373782792187910/EoCU5xlQ_normal.jpg","Mariano Arcioni","18050","<img src="" http://pbs.twimg.com/profile_images/927373782792187910/EoCU5xlQ_normal.jpg "" height=""52""></img>"
"1006431284","eldapertile","HCDN","HCDN_FDT_db"," ","TODXS","FRENTE DE TODOS","FRENTE DE TODOS","Diputada Nacional","http://pbs.twimg.com/profile_images/1294751705926696965/ndACqB9Q_normal.jpg","Elda Pértile","1929","<img src="" http://pbs.twimg.com/profile_images/1294751705926696965/ndACqB9Q_normal.jpg "" height=""52""></img>"
"298258503","gcipolini","HCDN","HCDN_JXC_db"," ","TODXS","JUNTOS POR EL CAMBIO","UCR","","http://pbs.twimg.com/profile_images/1352527006/twitter_normal.jpg","Gerardo Cipolini","784","<img src="" http://pbs.twimg.com/profile_images/1352527006/twitter_normal.jpg "" height=""52""></img>"
"1469894064","german_garavano","OTRXS","OTRXS_db"," ","TODXS",NA,NA,"Soy abogado y consultor en Reforma Judicial.","http://pbs.twimg.com/profile_images/1191527280222392321/lW5cSzZZ_normal.jpg","Germán Garavano","100164","<img src="" http://pbs.twimg.com/profile_images/1191527280222392321/lW5cSzZZ_normal.jpg "" height=""52""></img>"
"167751026","TOPOarg","HCDN","HCDN_FEDERAL_db"," ","TODXS","FEDERAL","CONSENSO FEDERAL","Peronista Bonaerense con LAVAGNA #ConsensoFederal","http://pbs.twimg.com/profile_images/1378573324670930947/yFUjOB26_normal.jpg","TOPO Rodríguez","8727","<img src="" http://pbs.twimg.com/profile_images/1378573324670930947/yFUjOB26_normal.jpg "" height=""52""></img>"
"3399074854","Martin_M_Guzman","PEN","PEN_db"," ","TODXS",NA,NA,"Ministro de Economía de la República Argentina.","http://pbs.twimg.com/profile_images/1338631243014041602/vQ_HaRLY_normal.jpg","Martín Guzmán","216136","<img src="" http://pbs.twimg.com/profile_images/1338631243014041602/vQ_HaRLY_normal.jpg "" height=""52""></img>"
"931564592328781824","RubinsteinOk","OTRXS","OTRXS_db"," ","TODXS",NA,NA,"Médico de familia. Doctor en Salud Pública y profesor de la UBA. Radical. Padre de mellizos. Ex Ministro de Salud de la Nación. Gallina desde la cuna.","http://pbs.twimg.com/profile_images/1294651301058482177/99iDnbX1_normal.jpg","Adolfo Rubinstein","34384","<img src="" http://pbs.twimg.com/profile_images/1294651301058482177/99iDnbX1_normal.jpg "" height=""52""></img>"
"466887457","CaroGaillard","HCDN","HCDN_FDT_db"," ","TODXS","FRENTE DE TODOS","FRENTE DE TODOS","Abogada. Dip. Nac. por la Pcia. de ER en Frente de Todos. Presidenta de la Comisión de Legislacion Penal. HCDN. Mamá de Felipe 💚🌈🌱","http://pbs.twimg.com/profile_images/1326944416322514945/gTzPExXK_normal.jpg","Carolina Gaillard","14081","<img src="" http://pbs.twimg.com/profile_images/1326944416322514945/gTzPExXK_normal.jpg "" height=""52""></img>"
"148194379","RobertoFeletti","OTRXS","OTRXS_db"," ","TODXS",NA,NA,"Secretario administrativo del @Senado_BA. Trabajo para mejorar la vida de las y de los bonaerenses. Peronista y de River","http://pbs.twimg.com/profile_images/790192312974471168/axnDK-aD_normal.jpg","Roberto Feletti","82525","<img src="" http://pbs.twimg.com/profile_images/790192312974471168/axnDK-aD_normal.jpg "" height=""52""></img>"
"191209101","RodolfoDonofrio","OTRXS","OTRXS_db"," ","TODXS",NA,NA,"Cuenta Oficial. Hincha, Socio Vitalicio. Presidente de @riverplate","http://pbs.twimg.com/profile_images/944636926501556225/SOQxj6ux_normal.jpg","Rodolfo D'Onofrio","348463","<img src="" http://pbs.twimg.com/profile_images/944636926501556225/SOQxj6ux_normal.jpg "" height=""52""></img>"
"253636753","Vsiley","HCDN","HCDN_FDT_db"," ","TODXS","FRENTE DE TODOS","FRENTE DE TODOS","Militante. Secretaria General de la Federación de Sindicatos de Trabajadores Judiciales. Diputada Nacional. Consejera de la Magistratura de la Nación.","http://pbs.twimg.com/profile_images/1167202237380255744/ABx6gzMN_normal.jpg","Vanesa Siley","28826","<img src="" http://pbs.twimg.com/profile_images/1167202237380255744/ABx6gzMN_normal.jpg "" height=""52""></img>"
"2204038493","AldoAdolfoLeiva","HCDN","HCDN_FDT_db"," ","TODXS","FRENTE DE TODOS","FRENTE DE TODOS","Diputado Nacional por el FDT, Padre de Familia, Ex Combatiente de Malvinas, Militante Peronista.","http://pbs.twimg.com/profile_images/629652043976810496/q2Ux5af7_normal.jpg","Aldo Adolfo Leiva","2343","<img src="" http://pbs.twimg.com/profile_images/629652043976810496/q2Ux5af7_normal.jpg "" height=""52""></img>"
"1204088748645978125","A_Carambia","HCDN","HCDN_UNIDFED_db"," ","TODXS","UNIDAD FEDERAL PARA EL DESARROLLO","UNIDAD Y EQUIDAD FEDERAL","Diputado Nacional por Santa Cruz-MoVeRe


Padre de Fran y Martu. Hincha de Boca","http://pbs.twimg.com/profile_images/1204089585338343425/NHCnYYZD_normal.jpg","Antonio Carambia","183","<img src="" http://pbs.twimg.com/profile_images/1204089585338343425/NHCnYYZD_normal.jpg "" height=""52""></img>"
"242461059","Lipovetzky","PROVINCIAL","PROV_db"," ","TODXS",NA,NA,"Diputado Provincia de Buenos Aires por Juntos por el Cambio! Diputado Nacional M.C. 2015-2019. De La Plata. Fana del más grande BOCA JUNIORS.Papá de tres soles.","http://pbs.twimg.com/profile_images/1293247104220004352/OK8rIm57_normal.jpg","Daniel Lipovetzky","42910","<img src="" http://pbs.twimg.com/profile_images/1293247104220004352/OK8rIm57_normal.jpg "" height=""52""></img>"
"1383349418","QuintelaRicardo","PROVINCIAL","PROV_db"," ","TODXS",NA,NA,"Gobernador de La Rioja. Presidente del Partido Justicialista de La Rioja","http://pbs.twimg.com/profile_images/1260693493749616640/rvdgN3s-_normal.jpg","Ricardo Quintela","18921","<img src="" http://pbs.twimg.com/profile_images/1260693493749616640/rvdgN3s-_normal.jpg "" height=""52""></img>"
"327429889","espinolacamau","HSN","HCSN_db"," ","TODXS",NA,NA,"Deportista olímpico, actualmente Senador Nacional por Corrientes.  (Cuenta oficial)","http://pbs.twimg.com/profile_images/880178422248558592/QnVSWu9m_normal.jpg","Camau Espinola","9911","<img src="" http://pbs.twimg.com/profile_images/880178422248558592/QnVSWu9m_normal.jpg "" height=""52""></img>"
"794738992315060224","AlmaSapag","HCDN","HCDN_OTRXS_db"," ","TODXS","OTRXS","MOV POP NEUQUINO","","http://pbs.twimg.com/profile_images/1212736589996199936/RTerBkmd_normal.jpg","ChaniSapag","1592","<img src="" http://pbs.twimg.com/profile_images/1212736589996199936/RTerBkmd_normal.jpg "" height=""52""></img>"
"1219628058547761152","LucilaCrexell","HSN","HCSN_db"," ","TODXS",NA,NA,"Neuquina.
Senadora Nacional (2019-2025).","http://pbs.twimg.com/profile_images/1358790469937991680/ho7hUEVA_normal.jpg","Lucila Crexell","2025","<img src="" http://pbs.twimg.com/profile_images/1358790469937991680/ho7hUEVA_normal.jpg "" height=""52""></img>"
"172841079","MariaMigliore","PROVINCIAL","PROV_db"," ","TODXS",NA,NA,"Humanizando la política desde adentro. Politóloga. Compañera de Lucas. Mamá de Guada y Cande. Ministra de Desarrollo Humano y Hábitat de @gcba.","http://pbs.twimg.com/profile_images/1274068885956890624/IHp0CpaH_normal.jpg","María Migliore","5196","<img src="" http://pbs.twimg.com/profile_images/1274068885956890624/IHp0CpaH_normal.jpg "" height=""52""></img>"
"4179135675","ZiliottoSergio","PROVINCIAL","PROV_db"," ","TODXS",NA,NA,"Gobernador de La Pampa","http://pbs.twimg.com/profile_images/1215774291909914634/vBm5uU4F_normal.jpg","Sergio Ziliotto","9815","<img src="" http://pbs.twimg.com/profile_images/1215774291909914634/vBm5uU4F_normal.jpg "" height=""52""></img>"
"705097329687322624","LuciMasin","HCDN","HCDN_FDT_db"," ","TODXS","FRENTE DE TODOS","FRENTE DE TODOS","Docente. Militante del campo nacional y popular ✌🏽.
Diputada Nacional 🇦🇷 por la provincia del #Chaco. 
🏛  2015 - 2019 (FPV)
🏛  2019 - 2023 (FDT)","http://pbs.twimg.com/profile_images/1189296101117120514/y1xHRZ5i_normal.jpg","Lucila Masin","14530","<img src="" http://pbs.twimg.com/profile_images/1189296101117120514/y1xHRZ5i_normal.jpg "" height=""52""></img>"
"37105151","fangelini","HCDN","HCDN_JXC_db"," ","TODXS","JUNTOS POR EL CAMBIO","PRO","Rosario, mi lugar en el mundo. Santa Fe mi Provincia. Militante todo terreno. Diputado Nacional de Juntos Por el Cambio. Vice Presidente de @ProArgentina","http://pbs.twimg.com/profile_images/1148302907563008000/ols7KphE_normal.jpg","Fede Angelini","18070","<img src="" http://pbs.twimg.com/profile_images/1148302907563008000/ols7KphE_normal.jpg "" height=""52""></img>"
"2578850396","NanniMiguel","HCDN","HCDN_JXC_db"," ","TODXS","JUNTOS POR EL CAMBIO","UCR","Padre. Abogado. Diputado Nacional UCR  #Cambiemos.","http://pbs.twimg.com/profile_images/1141125289147326465/QfovA-QA_normal.jpg","Miguel Nanni","3026","<img src="" http://pbs.twimg.com/profile_images/1141125289147326465/QfovA-QA_normal.jpg "" height=""52""></img>"
"3115013812","RominaDelPla","HCDN","HCDN_OTRXS_db"," ","TODXS","OTRXS","FRENTE DE IZQUIERDA Y DE LOS TRABAJADORES","Dip. Nac. (MC)del FIT, Prov. de Bs As. Sec. Gral. SUTEBA La Matanza. Dirigente Tribuna Docente y Partido Obrero. Escribo en @prensaobrera: https://t.co/Dtb1vFcbBG","http://pbs.twimg.com/profile_images/1124456507029032960/5e8XyiWW_normal.jpg","Romina Del Plá","20032","<img src="" http://pbs.twimg.com/profile_images/1124456507029032960/5e8XyiWW_normal.jpg "" height=""52""></img>"
"890281511630626817","gustavohein_","HCDN","HCDN_JXC_db"," ","TODXS","JUNTOS POR EL CAMBIO","PRO","Diputado Nacional por Entre Ríos #JuntosPorElCambio.
Casado y papá de dos hijas.","http://pbs.twimg.com/profile_images/1063806041513697285/2g_UaIVg_normal.jpg","Gustavo Hein","1968","<img src="" http://pbs.twimg.com/profile_images/1063806041513697285/2g_UaIVg_normal.jpg "" height=""52""></img>"
"1574367007","AndresZottos","HCDN","HCDN_FEDERAL_db"," ","TODXS","FEDERAL","JUSTICIALISTA","Diputado Nacional por Salta","http://pbs.twimg.com/profile_images/1015425656807620609/-ieth2FA_normal.jpg","Andrés Zottos","2952","<img src="" http://pbs.twimg.com/profile_images/1015425656807620609/-ieth2FA_normal.jpg "" height=""52""></img>"
"1048981442","davidsnqn","HCDN","HCDN_JXC_db"," ","TODXS","JUNTOS POR EL CAMBIO","PRO","Papá de Juanma, Miranda y Benjamín. Esposo de Alejandra. Cristiano. Contador Público. Actual Diputado Nacional por Neuquén. #JuntosPorElCambio","http://pbs.twimg.com/profile_images/1045433658071384064/CCpV7RgI_normal.jpg","David Schlereth","6949","<img src="" http://pbs.twimg.com/profile_images/1045433658071384064/CCpV7RgI_normal.jpg "" height=""52""></img>"
"217977555","LEBasterra","PEN","PEN_db"," ","TODXS",NA,NA,"Ingeniero Agrónomo. Ministro de Agricultura, Ganadería y Pesca de la República Argentina.","http://pbs.twimg.com/profile_images/1380595450093449219/3PFjDbj-_normal.jpg","Luis Basterra","16225","<img src="" http://pbs.twimg.com/profile_images/1380595450093449219/3PFjDbj-_normal.jpg "" height=""52""></img>"
"450577726","MaruMartiniOK","PROVINCIAL","PROV_db"," ","TODXS",NA,NA,"Legisladora provincial y Presidenta del Bloque Frente de Tod☀️s en Río Negro.","http://pbs.twimg.com/profile_images/1289590371522088965/N9yvLKom_normal.jpg","Maru Martini","3745","<img src="" http://pbs.twimg.com/profile_images/1289590371522088965/N9yvLKom_normal.jpg "" height=""52""></img>"
"891296900145713153","RCSalvarezza","PEN","PEN_db"," ","TODXS",NA,NA,"Ministro de Ciencia, Tecnología e Innovación de la Nación. Doctor en Bioquímica.","http://pbs.twimg.com/profile_images/1380559918932094981/i5qbj0rN_normal.jpg","Roberto Salvarezza","61284","<img src="" http://pbs.twimg.com/profile_images/1380559918932094981/i5qbj0rN_normal.jpg "" height=""52""></img>"
"724991849912500224","UniCiudadanaAR","OTRXS","OTRXS_db"," ","TODXS",NA,NA,"#ArgentinaDePie 🤍","http://pbs.twimg.com/profile_images/1240400929045839877/1HLX2Rmm_normal.jpg","Unidad Ciudadana 🇦🇷","196301","<img src="" http://pbs.twimg.com/profile_images/1240400929045839877/1HLX2Rmm_normal.jpg "" height=""52""></img>"
"314982614","DiGiacomoLuis","HCDN","HCDN_UNIDFED_db"," ","TODXS","UNIDAD FEDERAL PARA EL DESARROLLO","JUNTOS SOMOS RIO NEGRO","Diputado Nacional - Juntos Somos Río Negro. Ex ministro de Gobierno de mi provincia. Psiquiatra. Interbloque Unidad Federal para el Desarrollo.","http://pbs.twimg.com/profile_images/1351665837988577282/kha68Dxp_normal.jpg","Luis Di Giacomo","1862","<img src="" http://pbs.twimg.com/profile_images/1351665837988577282/kha68Dxp_normal.jpg "" height=""52""></img>"
"2610724446","adolfoRSquotes","HSN","HCSN_db"," ","TODXS",NA,NA,"","http://pbs.twimg.com/profile_images/1143691292691619840/_9T-kBDh_normal.png","Adolfo Rodriguez Saa","6200","<img src="" http://pbs.twimg.com/profile_images/1143691292691619840/_9T-kBDh_normal.png "" height=""52""></img>"
"933770253921857536","FundacionAlem","OTRXS","OTRXS_db"," ","TODXS",NA,NA,"Somos la fundación oficial de la UCR. Nos dedicamos al análisis de los problemas públicos argentinos y la formación política de los miembros del partido.","http://pbs.twimg.com/profile_images/1256214048263278602/WJCQk1wG_normal.jpg","Fundación Alem","7751","<img src="" http://pbs.twimg.com/profile_images/1256214048263278602/WJCQk1wG_normal.jpg "" height=""52""></img>"
"174286642","MarceloKoenig","HCDN","HCDN_FDT_db"," ","TODXS","FRENTE DE TODOS","FRENTE DE TODOS","Diputado Nacional,
Secretario general en Descamisados
Profesor universitario
Padre de Manu y Rafa y Peronista hastas los huesos.","http://pbs.twimg.com/profile_images/422930760610635776/GCGiRbHd_normal.jpeg","Marcelo Koenig","5561","<img src="" http://pbs.twimg.com/profile_images/422930760610635776/GCGiRbHd_normal.jpeg "" height=""52""></img>"
"199939113","enriquezjorge","HCDN","HCDN_JXC_db"," ","TODXS","JUNTOS POR EL CAMBIO","PRO","Diputado Nacional @juntoscambioar 💪🇦🇷 por la Ciudad Autónoma de Buenos Aires. Abogado UBA, Colegio Nacional de Buenos Aires. Un argentino de Ley. #ProVida 💙","http://pbs.twimg.com/profile_images/1373808856942440452/bHI3SJHD_normal.jpg","Jorge R. Enríquez","8420","<img src="" http://pbs.twimg.com/profile_images/1373808856942440452/bHI3SJHD_normal.jpg "" height=""52""></img>"
"705158078","fsancheznqn","HCDN","HCDN_JXC_db"," ","TODXS","JUNTOS POR EL CAMBIO","PRO","Diputado Nacional por Neuquén. 
Profamilia. Batallando por La Argentina grande.
Casado con María Inés, padre de 5.","http://pbs.twimg.com/profile_images/1285781883037650953/7NfxL8yR_normal.jpg","Francisco Sánchez 🇦🇷","19530","<img src="" http://pbs.twimg.com/profile_images/1285781883037650953/7NfxL8yR_normal.jpg "" height=""52""></img>"
"42637609","SantiCafiero","PEN","PEN_db"," ","TODXS",NA,NA,"Militante peronista. Licenciado en Ciencia Política (UBA). Jefe de Gabinete de la Nación.","http://pbs.twimg.com/profile_images/1380268866018934793/2_o0cmx-_normal.jpg","Santiago Cafiero","305797","<img src="" http://pbs.twimg.com/profile_images/1380268866018934793/2_o0cmx-_normal.jpg "" height=""52""></img>"
