"user_id","screen_name","Tipo_organismo","database","url_path","Tipo_organismo_2","Interbloque","diputado_bloque","description","profile_image_url","name","followers_count","image"
"349968963","dalessamauricio","OTRXS","OTRXS_db"," ","OTRXS",NA,NA,"Abogado. Panelista serial. DJ Dalessa Mago mail: mauriciodalessandro@hotmail.com . youtube: https://t.co/OT3RUnNAqO","http://pbs.twimg.com/profile_images/712608273803972608/HIBG8Me8_normal.jpg","Mauricio Dalessandro","190935","<img src="" http://pbs.twimg.com/profile_images/712608273803972608/HIBG8Me8_normal.jpg "" height=""52""></img>"
"417808516","SilviaEdePerez","HSN","HCSN_db"," ","HSN",NA,NA,"Madre de tres hijos. Defensora de la vida. Senadora Nacional por Tucumán.","http://pbs.twimg.com/profile_images/1082213753754714112/_rG1nw6N_normal.jpg","Silvia Elías de Pérez","31054","<img src="" http://pbs.twimg.com/profile_images/1082213753754714112/_rG1nw6N_normal.jpg "" height=""52""></img>"
"180536299","martinezdolom","HCDN","HCDN_JXC_db"," ","TODXS","JUNTOS POR EL CAMBIO","UCR","Diputada Nacional por #CABA
Antes, Directora de Modernización Parlamentaria en @DiputadosAR. Politóloga #UBA #ParlamentoAbierto
#EvolucionRadical 🇲🇨","http://pbs.twimg.com/profile_images/1150904275259789317/bPTjW_9S_normal.jpg","Dolores Martinez","2777","<img src="" http://pbs.twimg.com/profile_images/1150904275259789317/bPTjW_9S_normal.jpg "" height=""52""></img>"
"42637609","SantiCafiero","PEN","PEN_db"," ","PEN",NA,NA,"Militante peronista. Licenciado en Ciencia Política (UBA). Jefe de Gabinete de la Nación.","http://pbs.twimg.com/profile_images/1380268866018934793/2_o0cmx-_normal.jpg","Santiago Cafiero","305797","<img src="" http://pbs.twimg.com/profile_images/1380268866018934793/2_o0cmx-_normal.jpg "" height=""52""></img>"
"933770253921857536","FundacionAlem","OTRXS","OTRXS_db"," ","OTRXS",NA,NA,"Somos la fundación oficial de la UCR. Nos dedicamos al análisis de los problemas públicos argentinos y la formación política de los miembros del partido.","http://pbs.twimg.com/profile_images/1256214048263278602/WJCQk1wG_normal.jpg","Fundación Alem","7751","<img src="" http://pbs.twimg.com/profile_images/1256214048263278602/WJCQk1wG_normal.jpg "" height=""52""></img>"
"4919962521","inst_PATRIAar","OTRXS","OTRXS_db"," ","OTRXS",NA,NA,"Pensamiento, Acción y Trabajo para la Inclusión Americana | Fb: https://t.co/Jj1ysKku2x | Videos: https://t.co/pVEKwcnEgw","http://pbs.twimg.com/profile_images/917755585487044610/P3cmEuF3_normal.jpg","Instituto PATRIA","111640","<img src="" http://pbs.twimg.com/profile_images/917755585487044610/P3cmEuF3_normal.jpg "" height=""52""></img>"
"4707533116","TereGarciaOK","PROVINCIAL","PROV_db"," ","PROVINCIAL",NA,NA,"Militante peronista, Ministra de Gobierno de la Provincia de Buenos Aires.
IG: teregarciaok","http://pbs.twimg.com/profile_images/1250912051284840458/gvo10gSX_normal.jpg","Maria Teresa Garcia","42918","<img src="" http://pbs.twimg.com/profile_images/1250912051284840458/gvo10gSX_normal.jpg "" height=""52""></img>"
"267784293","marioraulnegri","HCDN","HCDN_JXC_db"," ","TODXS","JUNTOS POR EL CAMBIO","UCR","Diputado Nacional - Córdoba - Presidente del Bloque UCR y del Interbloque Juntos por el Cambio.","http://pbs.twimg.com/profile_images/1042446986371321858/ZVKQC5TA_normal.jpg","Mario Raúl Negri","201947","<img src="" http://pbs.twimg.com/profile_images/1042446986371321858/ZVKQC5TA_normal.jpg "" height=""52""></img>"
"2373627522","LuciaCorpacci","HCDN","HCDN_FDT_db"," ","HCDN","FRENTE DE TODOS","FRENTE DE TODOS","Diputada Nacional Frente de Todos -
Ex Gobernadora de la Provincia de Catamarca (2011 - 2019)","http://pbs.twimg.com/profile_images/658699160070299648/izXTBa-2_normal.jpg","Lucía Corpacci","10209","<img src="" http://pbs.twimg.com/profile_images/658699160070299648/izXTBa-2_normal.jpg "" height=""52""></img>"
"174801590","ReyesFernanda","PROVINCIAL","PROV_db"," ","PROVINCIAL",NA,NA,"Economista. CC ARI.
Directora del Instituto de Vivienda de la Ciudad de Buenos Aires. 
Coord. del Foro de Legisladores de la CCARI.
Casada y mamá de tres soles.","http://pbs.twimg.com/profile_images/1272520738914910214/9-Y5wEPr_normal.jpg","Fernanda Reyes","12049","<img src="" http://pbs.twimg.com/profile_images/1272520738914910214/9-Y5wEPr_normal.jpg "" height=""52""></img>"
"535633686","rossi_delfina","PROVINCIAL","PROV_db"," ","PROVINCIAL",NA,NA,"Porteña por elección. Feminista. Directora @BancoCiudad. Docente @EconomiaenUNDAV.  Referente de @buenosaires3d @agendarg. Entre Tod☀️s.","http://pbs.twimg.com/profile_images/1242648716529610753/jIe9YPLE_normal.jpg","Delfi Rossi","43303","<img src="" http://pbs.twimg.com/profile_images/1242648716529610753/jIe9YPLE_normal.jpg "" height=""52""></img>"
"299371033","fstraface","PROVINCIAL","PROV_db"," ","TODXS",NA,NA,"El pesimista se queja del viento,
el optimista espera que cambie, y
el realista ajusta las velas. (Ward, 1882).","http://pbs.twimg.com/profile_images/1023943906617188352/x9oBE4Cf_normal.jpg","Fernando Straface","3215","<img src="" http://pbs.twimg.com/profile_images/1023943906617188352/x9oBE4Cf_normal.jpg "" height=""52""></img>"
"1598951042","gabiestevezok","HCDN","HCDN_FDT_db"," ","TODXS","FRENTE DE TODOS","FRENTE DE TODOS","🇦🇷☀️ Nacional, Popular y Feminista 💜💚
Diputada Nacional por Córdoba 
🏛 FPV - PJ 2015 - 2019 
🏛 @frentedetodos 2019 - 2023","http://pbs.twimg.com/profile_images/1378325725464428544/ETC-GBCZ_normal.jpg","Gabriela Estévez","41133","<img src="" http://pbs.twimg.com/profile_images/1378325725464428544/ETC-GBCZ_normal.jpg "" height=""52""></img>"
"3092373641","alfredocornejo","HCDN","HCDN_JXC_db"," ","HCDN","JUNTOS POR EL CAMBIO","UCR","Graduado en Ciencia Política - Ex Gobernador de Mendoza - Diputado Nacional por Mendoza - Presidente de la @UCRNacional","http://pbs.twimg.com/profile_images/1362539287401611270/sqkcjTLI_normal.jpg","Alfredo Cornejo","67601","<img src="" http://pbs.twimg.com/profile_images/1362539287401611270/sqkcjTLI_normal.jpg "" height=""52""></img>"
"1483041949","MinSeg","PEN","PEN_db"," ","PEN",NA,NA,"Ministerio de Seguridad de la Nación Argentina","http://pbs.twimg.com/profile_images/1387387341803765766/WNm9WM9a_normal.png","Ministerio Seguridad","472113","<img src="" http://pbs.twimg.com/profile_images/1387387341803765766/WNm9WM9a_normal.png "" height=""52""></img>"
"3005444542","BeatrizMirkinOk","HSN","HCSN_db"," ","HSN",NA,NA,"Senadora Nacional por Tucumán junto a @jalperovichok. Peronista. Militante por los derechos de las mujeres./ Instagram: @beatrizmirkinok","http://pbs.twimg.com/profile_images/1368958783712620548/AOM4RgP7_normal.jpg","Beatriz Mirkin","5094","<img src="" http://pbs.twimg.com/profile_images/1368958783712620548/AOM4RgP7_normal.jpg "" height=""52""></img>"
"308076846","gabrielfrizza","HCDN","HCDN_JXC_db"," ","HCDN","JUNTOS POR EL CAMBIO","PRO","Diputado Nacional por Córdoba de #Cambiemos. Intendente de Jesús María (2011-2017). Casado y papá de 4 hijos. #CambiandoJuntos 🇦🇷","http://pbs.twimg.com/profile_images/1266354029573087232/FEtXyR8H_normal.jpg","Gabriel Frizza","5799","<img src="" http://pbs.twimg.com/profile_images/1266354029573087232/FEtXyR8H_normal.jpg "" height=""52""></img>"
"130574455","OscarAguadCBA","OTRXS","OTRXS_db"," ","OTRXS",NA,NA,"Cordobés, Abogado, Hincha de Belgrano. Ministro en la gestión del Presidente Macri (2015-2019)","http://pbs.twimg.com/profile_images/378800000120820038/f8571ed951fed1a0b17f57e32d78bd79_normal.png","Oscar Aguad","37261","<img src="" http://pbs.twimg.com/profile_images/378800000120820038/f8571ed951fed1a0b17f57e32d78bd79_normal.png "" height=""52""></img>"
"779340061263425537","SaludBAP","PROVINCIAL","PROV_db"," ","PROVINCIAL",NA,NA,"Cuenta oficial del Ministerio de Salud de la Provincia de Buenos Aires.","http://pbs.twimg.com/profile_images/1333519748844449793/VmBHfJD3_normal.jpg","SaludBAP","39131","<img src="" http://pbs.twimg.com/profile_images/1333519748844449793/VmBHfJD3_normal.jpg "" height=""52""></img>"
"2931794813","MaggieSolariQ","HSN","HCSN_db"," ","HSN",NA,NA,"Senadora Nacional por Misiones💄 Renovadora a morir de hoy y siempre!!👰 Sin bombo, con el sonido de mi pueblo latiendo en mi ❤!","http://pbs.twimg.com/profile_images/1183219860706418689/mHWr60dX_normal.jpg","Maggie Solari Q","3462","<img src="" http://pbs.twimg.com/profile_images/1183219860706418689/mHWr60dX_normal.jpg "" height=""52""></img>"
"1578961946","elisacarrio","OTRXS","OTRXS_db"," ","OTRXS",NA,NA,"Ex Diputada Nacional CC-ARI","http://pbs.twimg.com/profile_images/718212477725581312/nP2TxZpu_normal.jpg","Elisa Lilita Carrió","1240067","<img src="" http://pbs.twimg.com/profile_images/718212477725581312/nP2TxZpu_normal.jpg "" height=""52""></img>"
"110043455","JesicaRey","PROVINCIAL","PROV_db"," ","PROVINCIAL",NA,NA,"Ganar y no ganar no es lo mismo, pero ningún éxito inmuniza. // Ministra de Comunicación Pública del Gobierno de la Provincia de Buenos Aires.💚","http://pbs.twimg.com/profile_images/1205503564883353601/YoAaqUVc_normal.jpg","Jesica Rey","6267","<img src="" http://pbs.twimg.com/profile_images/1205503564883353601/YoAaqUVc_normal.jpg "" height=""52""></img>"
"1204760490200702976","JoseNederSDE","HSN","HCSN_db"," ","HSN",NA,NA,"Senador Nacional. Presidente del Partido Justicialista Distrito Santiago del Estero.","http://pbs.twimg.com/profile_images/1204775238988423168/hwVDZ8VD_normal.jpg","José Emilio Neder","695","<img src="" http://pbs.twimg.com/profile_images/1204775238988423168/hwVDZ8VD_normal.jpg "" height=""52""></img>"
"906250960573530113","RauschenbergerA","HCDN","HCDN_FDT_db"," ","HCDN","FRENTE DE TODOS","FRENTE DE TODOS","Diputado Nacional por la provincia de La Pampa.","http://pbs.twimg.com/profile_images/1210683518143156225/RD9_iYBb_normal.jpg","Ariel Rauschenberger","1908","<img src="" http://pbs.twimg.com/profile_images/1210683518143156225/RD9_iYBb_normal.jpg "" height=""52""></img>"
"161308045","jusgobar","PEN","PEN_db"," ","PEN",NA,NA,"Ministerio de Justicia y Derechos Humanos de la Nación","http://pbs.twimg.com/profile_images/1387399200246272008/7RbZizvD_normal.jpg","Min. Justicia y DDHH","135728","<img src="" http://pbs.twimg.com/profile_images/1387399200246272008/7RbZizvD_normal.jpg "" height=""52""></img>"
"167751026","TOPOarg","HCDN","HCDN_FEDERAL_db"," ","HCDN","FEDERAL","CONSENSO FEDERAL","Peronista Bonaerense con LAVAGNA #ConsensoFederal","http://pbs.twimg.com/profile_images/1378573324670930947/yFUjOB26_normal.jpg","TOPO Rodríguez","8727","<img src="" http://pbs.twimg.com/profile_images/1378573324670930947/yFUjOB26_normal.jpg "" height=""52""></img>"
"34335037","alejandrocacace","HCDN","HCDN_JXC_db"," ","HCDN","JUNTOS POR EL CAMBIO","UCR","Diputado de la Nación Argentina 🇦🇷 @ucrnacional. Sanluiseño. 36 años. Ariano. Boquense. Hijo de Javier y Susana.","http://pbs.twimg.com/profile_images/1142524217042317313/eDpAx6kL_normal.jpg","Alejandro Cacace","6774","<img src="" http://pbs.twimg.com/profile_images/1142524217042317313/eDpAx6kL_normal.jpg "" height=""52""></img>"
"162181568","slospennato","HCDN","HCDN_JXC_db"," ","TODXS","JUNTOS POR EL CAMBIO","PRO","Trabajadora incansable, orgullosa de ser parte del Equipo Pro. Diputada Nacional y Secretaria Parlamentaria del Interbloque CAMBIEMOS","http://pbs.twimg.com/profile_images/1031293810968547328/2xS_Q5no_normal.jpg","Silvia Lospennato","35408","<img src="" http://pbs.twimg.com/profile_images/1031293810968547328/2xS_Q5no_normal.jpg "" height=""52""></img>"
"50445713","fabiojquetglas","HCDN","HCDN_JXC_db"," ","HCDN","JUNTOS POR EL CAMBIO","UCR","Mg. en Gestión de Ciudades | Director de la Maestría en Ciudades - UBA | Diputado Nacional por la provincia de Buenos Aires | @ucrnacional - @juntoscambioar","http://pbs.twimg.com/profile_images/1375130249919352839/I-Z-5fLl_normal.jpg","Fabio Quetglas","12909","<img src="" http://pbs.twimg.com/profile_images/1375130249919352839/I-Z-5fLl_normal.jpg "" height=""52""></img>"
"236458875","EliGAlcorta","PEN","PEN_db"," ","PEN",NA,NA,"Ministra de las Mujeres, Géneros y Diversidad. Abogada DDHH. Docente (UBA). Feminista.","http://pbs.twimg.com/profile_images/1380607809499361283/9AEUMRZu_normal.jpg","Eli Gomez Alcorta","61667","<img src="" http://pbs.twimg.com/profile_images/1380607809499361283/9AEUMRZu_normal.jpg "" height=""52""></img>"
"3045089584","ReutemannC","HSN","HCSN_db"," ","HSN",NA,NA,"Senador Nacional por Santa Fe. Ex piloto de F1. Casado, papá de Cora y Mariana, abuelo de Santiago. Productor agropecuario.","http://pbs.twimg.com/profile_images/568510472563867648/s-jvy4CT_normal.jpeg","Carlos Reutemann","2554","<img src="" http://pbs.twimg.com/profile_images/568510472563867648/s-jvy4CT_normal.jpeg "" height=""52""></img>"
"24900072","mauriciomacri","OTRXS","OTRXS_db"," ","TODXS",NA,NA,"Ex presidente de la República Argentina. Miembro fundador de PRO Argentina y Cambiemos. Casado. 4 hijos. Hincha de Boca.","http://pbs.twimg.com/profile_images/653558348273569792/joxg8DZD_normal.png","Mauricio Macri","5123468","<img src="" http://pbs.twimg.com/profile_images/653558348273569792/joxg8DZD_normal.png "" height=""52""></img>"
"3125573339","OsmarMonaldi","HCDN","HCDN_JXC_db"," ","HCDN","JUNTOS POR EL CAMBIO","PRO","Jujeño. Diputado Nacional por Jujuy","http://pbs.twimg.com/profile_images/883751276873469953/NbM1IqtM_normal.jpg","Osmar Monaldi","1616","<img src="" http://pbs.twimg.com/profile_images/883751276873469953/NbM1IqtM_normal.jpg "" height=""52""></img>"
"117185027","SergioMassa","HCDN","HCDN_FDT_db"," ","HCDN","FRENTE DE TODOS","FRENTE DE TODOS","Abogado. Presidente de la Honorable Cámara de @DiputadosAR. #ArgentinaUnida #MayoríaArgentina♥️🇦🇷","http://pbs.twimg.com/profile_images/1242767194024484865/i2-LWf2W_normal.jpg","Sergio Massa","1151273","<img src="" http://pbs.twimg.com/profile_images/1242767194024484865/i2-LWf2W_normal.jpg "" height=""52""></img>"
"891296900145713153","RCSalvarezza","PEN","PEN_db"," ","PEN",NA,NA,"Ministro de Ciencia, Tecnología e Innovación de la Nación. Doctor en Bioquímica.","http://pbs.twimg.com/profile_images/1380559918932094981/i5qbj0rN_normal.jpg","Roberto Salvarezza","61284","<img src="" http://pbs.twimg.com/profile_images/1380559918932094981/i5qbj0rN_normal.jpg "" height=""52""></img>"
"317214518","TurismoNacionAR","PEN","PEN_db"," ","PEN",NA,NA,"Cuenta oficial del turismo de la Argentina.","http://pbs.twimg.com/profile_images/1387410132145999873/9fBk6V3b_normal.png","Turismo Argentina","233417","<img src="" http://pbs.twimg.com/profile_images/1387410132145999873/9fBk6V3b_normal.png "" height=""52""></img>"
"293682722","HugoYasky","HCDN","HCDN_FDT_db"," ","HCDN","FRENTE DE TODOS","FRENTE DE TODOS","🇦🇷 Secretario General de la Central de Trabajadores de la Argentina — @CTAok. Diputado Nacional de @UniCiudadanaAr.","http://pbs.twimg.com/profile_images/976107859246243841/QEZ5Ur9X_normal.jpg","Hugo Yasky","125378","<img src="" http://pbs.twimg.com/profile_images/976107859246243841/QEZ5Ur9X_normal.jpg "" height=""52""></img>"
"332993154","myriambregman","PROVINCIAL","PROV_db"," ","PROVINCIAL",NA,NA,"PTS/Frente de Izquierda. Abogada defensora de las libertades democráticas y de trabajadorxs. Diputada CABA 2018/2021.","http://pbs.twimg.com/profile_images/1334634693778690049/tbGKa-xt_normal.jpg","Myriam Bregman","161101","<img src="" http://pbs.twimg.com/profile_images/1334634693778690049/tbGKa-xt_normal.jpg "" height=""52""></img>"
"705097329687322624","LuciMasin","HCDN","HCDN_FDT_db"," ","HCDN","FRENTE DE TODOS","FRENTE DE TODOS","Docente. Militante del campo nacional y popular ✌🏽.
Diputada Nacional 🇦🇷 por la provincia del #Chaco. 
🏛  2015 - 2019 (FPV)
🏛  2019 - 2023 (FDT)","http://pbs.twimg.com/profile_images/1189296101117120514/y1xHRZ5i_normal.jpg","Lucila Masin","14530","<img src="" http://pbs.twimg.com/profile_images/1189296101117120514/y1xHRZ5i_normal.jpg "" height=""52""></img>"
"211132363","bazzemiguel","HCDN","HCDN_JXC_db"," ","HCDN","JUNTOS POR EL CAMBIO","UCR","Platense por decisión. Alfonsinista. Diputado Nacional. Sec.  Gral.  Bloque UCR. Siempre trabajando por la provincia de Buenos Aires que todos nos merecemos","http://pbs.twimg.com/profile_images/538850170759180289/R-1VXhUU_normal.jpeg","Miguel Bazze","7254","<img src="" http://pbs.twimg.com/profile_images/538850170759180289/R-1VXhUU_normal.jpeg "" height=""52""></img>"
"1202300210837413888","JulioVitobello","PEN","PEN_db"," ","PEN",NA,NA,"Abogado (UBA). Hincha de River. Secretario General de la Presidencia","http://pbs.twimg.com/profile_images/1375059093841383424/7Pjt8Ik4_normal.jpg","Julio Vitobello","9781","<img src="" http://pbs.twimg.com/profile_images/1375059093841383424/7Pjt8Ik4_normal.jpg "" height=""52""></img>"
"112822128","mayrasmendoza","PROVINCIAL","PROV_db"," ","PROVINCIAL",NA,NA,"Intendenta de @QuilmesMuni.","http://pbs.twimg.com/profile_images/1062396891743313921/CE7Q61gA_normal.jpg","Mayra Mendoza ☀️","163993","<img src="" http://pbs.twimg.com/profile_images/1062396891743313921/CE7Q61gA_normal.jpg "" height=""52""></img>"
"297784596","AlciraArgumedo","OTRXS","OTRXS_db"," ","OTRXS",NA,NA,"Docente | Socióloga | Investigadora del Conicet | Directora Revista https://t.co/3nAJDekgt3","http://pbs.twimg.com/profile_images/929396144278507521/6ygs4eqz_normal.jpg","Alcira Argumedo","88870","<img src="" http://pbs.twimg.com/profile_images/929396144278507521/6ygs4eqz_normal.jpg "" height=""52""></img>"
"339334958","GerardoMorales","PROVINCIAL","PROV_db"," ","PROVINCIAL",NA,NA,"Gobernador de Jujuy. ""La consigna de nuestra Provincia es: Unidos, Responsables y Solidarios""","http://pbs.twimg.com/profile_images/1073728262130552837/vfllVsO2_normal.jpg","Gerardo Morales","87843","<img src="" http://pbs.twimg.com/profile_images/1073728262130552837/vfllVsO2_normal.jpg "" height=""52""></img>"
"233577586","joselriccardo","HCDN","HCDN_JXC_db"," ","TODXS","JUNTOS POR EL CAMBIO","UCR","Profesor. Diputado de la Nación. Presidente de la Comisión de Ciencia y Tecnología de la HCDN. Doctor en Física. Ex Rector de la UNSL 2007-13.","http://pbs.twimg.com/profile_images/922555239366123522/LAaFeI5l_normal.jpg","Jose Riccardo","3859","<img src="" http://pbs.twimg.com/profile_images/922555239366123522/LAaFeI5l_normal.jpg "" height=""52""></img>"
"155639783","ceciliamoreauok","HCDN","HCDN_FDT_db"," ","HCDN","FRENTE DE TODOS","FRENTE DE TODOS","B☀️naerense, militante del @FrenteDeTodos. Diputada Nacional, Vicepresidenta del bloque @Diputados_todos, mamá de Francisca. #QuedateEnCasa","http://pbs.twimg.com/profile_images/1340017817287069699/9DmGp295_normal.jpg","Cecilia Moreau","29782","<img src="" http://pbs.twimg.com/profile_images/1340017817287069699/9DmGp295_normal.jpg "" height=""52""></img>"
"35776604","felipe_sola","PEN","PEN_db"," ","PEN",NA,NA,"Ministro de Relaciones Exteriores, Comercio Internacional y Culto de la República Argentina.","http://pbs.twimg.com/profile_images/1048221677551865858/ySlsFHi1_normal.jpg","Felipe Solá","288813","<img src="" http://pbs.twimg.com/profile_images/1048221677551865858/ySlsFHi1_normal.jpg "" height=""52""></img>"
"327524667","Facundo_Moyano","HCDN","HCDN_FDT_db"," ","HCDN","FRENTE DE TODOS","FRENTE DE TODOS","Argentino, marplatense y peronista. Hincha de Alvarado de Mar del Plata. Diputado de la Nación. Instagram: facundomoyanook","http://pbs.twimg.com/profile_images/960645932713902081/RiAsPahO_normal.jpg","Facundo Moyano","144803","<img src="" http://pbs.twimg.com/profile_images/960645932713902081/RiAsPahO_normal.jpg "" height=""52""></img>"
"3237099209","marioaleito","HCDN","HCDN_FDT_db"," ","HCDN","FRENTE DE TODOS","FRENTE DE TODOS","Diputado nacional por Tucumán (FDT). Congresal nacional del @p_justicialista. Presidente del Club @ATOficial. Vicepresidente 3° de @LigaAFA.","http://pbs.twimg.com/profile_images/1386695594438234120/DEtSY9X7_normal.jpg","Mario Leito","6198","<img src="" http://pbs.twimg.com/profile_images/1386695594438234120/DEtSY9X7_normal.jpg "" height=""52""></img>"
"65360466","PartidoObrero","OTRXS","OTRXS_db"," ","OTRXS",NA,NA,"Partido Obrero de Argentina (cuenta oficial) Integrante del Frente de Izquierda y de los Trabajadores","http://pbs.twimg.com/profile_images/1041712502260817924/I6mgFMkh_normal.jpg","Partido Obrero","36255","<img src="" http://pbs.twimg.com/profile_images/1041712502260817924/I6mgFMkh_normal.jpg "" height=""52""></img>"
"172841079","MariaMigliore","PROVINCIAL","PROV_db"," ","PROVINCIAL",NA,NA,"Humanizando la política desde adentro. Politóloga. Compañera de Lucas. Mamá de Guada y Cande. Ministra de Desarrollo Humano y Hábitat de @gcba.","http://pbs.twimg.com/profile_images/1274068885956890624/IHp0CpaH_normal.jpg","María Migliore","5196","<img src="" http://pbs.twimg.com/profile_images/1274068885956890624/IHp0CpaH_normal.jpg "" height=""52""></img>"
"4077587662","JAlperovichOk","HSN","HCSN_db"," ","HSN",NA,NA,"Senador Nacional por Tucumán.","http://pbs.twimg.com/profile_images/1118642069717827586/Q-JAqVaM_normal.png","José Alperovich","9399","<img src="" http://pbs.twimg.com/profile_images/1118642069717827586/Q-JAqVaM_normal.png "" height=""52""></img>"
"251550471","sacnun","HSN","HCSN_db"," ","TODXS",NA,NA,"Militante Peronista✌
Senadora Nacional por la Provincia de Santa Fe - Frente de Tod☀️s
Abogada ⚖","http://pbs.twimg.com/profile_images/1372990194664738826/GdUSTGKP_normal.jpg","María de los Angeles Sacnun","9057","<img src="" http://pbs.twimg.com/profile_images/1372990194664738826/GdUSTGKP_normal.jpg "" height=""52""></img>"
"267960594","CrisAlvarezRod","HCDN","HCDN_FDT_db"," ","HCDN","FRENTE DE TODOS","FRENTE DE TODOS","Arquitecta. Peronista. Diputada Nacional. Presidenta ad honorem del @MuseoEvita","http://pbs.twimg.com/profile_images/1260292659857547264/bukoLO-Z_normal.jpg","Cristina Alvarez Rodríguez","73594","<img src="" http://pbs.twimg.com/profile_images/1260292659857547264/bukoLO-Z_normal.jpg "" height=""52""></img>"
"259717758","M_Campagnoli","HCDN","HCDN_JXC_db"," ","HCDN","JUNTOS POR EL CAMBIO","COALICION CIVICA","Bonaerense. Diputada Nacional. Coalición Cívica ARI-Cambiemos. Profesora de historia. Abogada. Trabajo por la educación, la justicia y la República.","http://pbs.twimg.com/profile_images/1193970537313247234/5sW_U5cD_normal.jpg","Marcela Campagnoli","39817","<img src="" http://pbs.twimg.com/profile_images/1193970537313247234/5sW_U5cD_normal.jpg "" height=""52""></img>"
"191209101","RodolfoDonofrio","OTRXS","OTRXS_db"," ","OTRXS",NA,NA,"Cuenta Oficial. Hincha, Socio Vitalicio. Presidente de @riverplate","http://pbs.twimg.com/profile_images/944636926501556225/SOQxj6ux_normal.jpg","Rodolfo D'Onofrio","348463","<img src="" http://pbs.twimg.com/profile_images/944636926501556225/SOQxj6ux_normal.jpg "" height=""52""></img>"
"69668594","LupeTagliaferri","HSN","HCSN_db"," ","HSN",NA,NA,"Vehemente pero no necia. Vivo sin odio. Senadora nacional por la Ciudad de Buenos Aires. Exministra de Desarrollo Humano y Hábitat del GCBA. Mamá de un varón.","http://pbs.twimg.com/profile_images/1269428600014622720/h3Vn9enu_normal.jpg","Guadalupe Tagliaferri","9556","<img src="" http://pbs.twimg.com/profile_images/1269428600014622720/h3Vn9enu_normal.jpg "" height=""52""></img>"
"1723102656","LaspinaL","HCDN","HCDN_JXC_db"," ","HCDN","JUNTOS POR EL CAMBIO","PRO","Economista. Enamorado de mi familia. Hincha de Newell's. Diputado Nacional.","http://pbs.twimg.com/profile_images/971771058809393152/7lSKa0Xq_normal.jpg","Luciano Laspina","33998","<img src="" http://pbs.twimg.com/profile_images/971771058809393152/7lSKa0Xq_normal.jpg "" height=""52""></img>"
"1009573922671603712","MariabTapia","HSN","HCSN_db"," ","HSN",NA,NA,"Senadora Nacional-Santa Cruz Cristiana Mamá de 2 niñas traviesas, curiosas y sensibles. Enamorada de Leandro 
Ing. Quimica Industrial -UNC
Hincha de CABJ 💙💛💙","http://pbs.twimg.com/profile_images/1009578664437207041/7XrSmep__normal.jpg","María Belén Tapia","2026","<img src="" http://pbs.twimg.com/profile_images/1009578664437207041/7XrSmep__normal.jpg "" height=""52""></img>"
"2795307903","MoniMacha","HCDN","HCDN_FDT_db"," ","HCDN","FRENTE DE TODOS","FRENTE DE TODOS","☀️ Diputada Nacional por @frentedetodos   💚 Militante kirchnerista por un proyecto plurinacional, transfeminista y popular 📕 Lic. en Psicología","http://pbs.twimg.com/profile_images/1384871543122051078/34ss930i_normal.jpg","Mónica Macha","38827","<img src="" http://pbs.twimg.com/profile_images/1384871543122051078/34ss930i_normal.jpg "" height=""52""></img>"
"131394303","atiliobenedetti","HCDN","HCDN_JXC_db"," ","HCDN","JUNTOS POR EL CAMBIO","UCR","Diputado nacional por la UCR en JxC Juntos por el Cambio
@juntoscambioar","http://pbs.twimg.com/profile_images/1358036472700493825/i-GHGIz6_normal.jpg","Atilio Benedetti","5310","<img src="" http://pbs.twimg.com/profile_images/1358036472700493825/i-GHGIz6_normal.jpg "" height=""52""></img>"
"155434166","AmelieGranata","PROVINCIAL","PROV_db"," ","PROVINCIAL",NA,NA,"#Rosarina #Pisciana. Periodista. Diputada Provincial de Santa Fe #CuidemosLas2vidas","http://pbs.twimg.com/profile_images/1013528632848015361/4lDt2R3O_normal.jpg","Amalia Granata 💙💙","2161203","<img src="" http://pbs.twimg.com/profile_images/1013528632848015361/4lDt2R3O_normal.jpg "" height=""52""></img>"
"998938602699743235","JimehLatorre","HCDN","HCDN_JXC_db"," ","HCDN","JUNTOS POR EL CAMBIO","UCR","Sanrafaelina - Diputada Nacional UCR por Mendoza","http://pbs.twimg.com/profile_images/1379135307770171408/A-fIQvd8_normal.jpg","Jimena Latorre","3503","<img src="" http://pbs.twimg.com/profile_images/1379135307770171408/A-fIQvd8_normal.jpg "" height=""52""></img>"
